TASKE	Beskrivning	"Fråga&nbsp;1"	"Fråga&nbsp;2"
Teori	"- a) Beskrivning och definitioner av i litteraturen förekommande begrepp, perspektiv och teorier, och användning av dem. <br/>- b) Användning av relevanta artiklar."	"0–8 poäng"	"0–5 poäng"
Analys	"- a) Analys av `empirin` exempelvis genom en tillämpning av begrepp, perspektiv, teorier. <br/>- b) Analys och syntetisering av `teorier`"	"0–6 poäng"	"0–3 poäng"
Struktur	"Kvalitet och logik i argumentationen. Sekvens av argumentationen, argumenten kopplar an till teorier, röd tråd, grammatik, stavning."	"0–6 poäng"	"0–2 poäng"
Kreativitet	"Gå utanför det uppenbara i teorierna och valda empiriska exempel. Kan visa sig i val, argumentation, slutsatser, etc."	"0–2 poäng"	"0–2 poäng"
Empiri	"Kvalitén och urval av empiriskt material, samt reflekterande förhållningssätt och källkritik till materialet (medvetenhet avsändares avsikt med kommunikation, etc.)"	"0–4 poäng"	"0–2 poäng"
Totalt	"&nbsp;"	"26 poäng"	"14 poäng"
